{
  "structure_id": "example:abandoned_research_complex",
  "operation": "generate",
  "structure_type": "underground_complex",
  "target_version": "1.20.1",
  "scale": 1.0,
  "grade": "HEAVY_REBUILD",
  "purpose": {
    "kind": "laboratory",
    "required_zones": [
      "entry",
      "reception",
      "laboratory",
      "utilities",
      "storage",
      "secure_core"
    ]
  },
  "theme": {
    "name": "industrial_research_ruin",
    "culture": "project_defined",
    "institution": "research_institute",
    "silhouette_rules": [
      "service-heavy massing",
      "secure inner core"
    ],
    "damage_language": [
      "selective collapse",
      "water intrusion",
      "abandoned utilities"
    ]
  },
  "context": {
    "dimension": "minecraft:overworld",
    "terrain": "underground",
    "approach_vectors": [
      "surface_access",
      "service_tunnel"
    ]
  },
  "generation": {
    "kind": "modular_dungeon",
    "materialize_nbt": true,
    "emit_binary": false,
    "layout": {
      "seed": 9001,
      "corridor_style": "bent",
      "size": {
        "min_width": 48,
        "min_depth": 40,
        "max_width": 96,
        "max_depth": 96,
        "preferred_width": 72,
        "preferred_depth": 60,
        "floors": 1
      },
      "modularity": {
        "triple_fold": true,
        "macro_module": 12,
        "meso_module": 4,
        "micro_module": 1,
        "connector_width": 3
      }
    },
    "palette": {
      "floor": "minecraft:polished_andesite",
      "wall": "minecraft:stone_bricks",
      "roof": "minecraft:stone_brick_slab"
    },
    "materialization_mode": "auto"
  }
}
